{
  "schema_version": 1,
  "default_profile": "direct",
  "profiles": [
    {
      "id": "direct",
      "version": 1,
      "name": "Direct",
      "description": "Live text goes straight into the field and the final transcript is committed on Stop, exactly as recognized. A leading mode phrase switches this take to another mode.",
      "intent": "dictate",
      "behavior": "faithful",
      "prompt_file": null,
      "aliases": [],
      "allow_spoken_overrides": true,
      "vocabulary": [],
      "snippets": [],
      "asr_route": "local-default",
      "authoring_route": null,
      "local_only": true,
      "selected_text": "off",
      "selection_required": false,
      "clipboard": false,
      "max_context_characters": 0,
      "transform_kinds": [],
      "language": null,
      "style": null,
      "spoken_commands": false,
      "context_fields": [],
      "processing_delivery": "direct",
      "delivery": "insert",
      "automatic_delivery": true
    },
    {
      "id": "verbatim",
      "version": 1,
      "name": "Literal",
      "description": "Selected by a leading \"literal\": the rest of the take is inserted exactly as recognized, with no mode phrases or spoken commands.",
      "intent": "dictate",
      "behavior": "verbatim",
      "prompt_file": null,
      "aliases": [],
      "allow_spoken_overrides": false,
      "vocabulary": [],
      "snippets": [],
      "asr_route": "local-default",
      "authoring_route": null,
      "local_only": true,
      "selected_text": "off",
      "selection_required": false,
      "clipboard": false,
      "max_context_characters": 0,
      "transform_kinds": [],
      "language": null,
      "style": null,
      "spoken_commands": false,
      "context_fields": [],
      "processing_delivery": "direct",
      "delivery": "insert",
      "automatic_delivery": true
    },
    {
      "id": "draft",
      "version": 1,
      "name": "Draft",
      "description": "Stop does not insert: the take waits in an editable draft above the keyboard. Spoken punctuation and layout commands (\"comma\", \"new line\", \"bullet\") become a processed proposal; the raw transcript stays one tap away.",
      "intent": "dictate",
      "behavior": "faithful",
      "prompt_file": null,
      "aliases": [
        "draft mode"
      ],
      "allow_spoken_overrides": true,
      "vocabulary": [],
      "snippets": [],
      "asr_route": "local-default",
      "authoring_route": null,
      "local_only": true,
      "selected_text": "off",
      "selection_required": false,
      "clipboard": false,
      "max_context_characters": 0,
      "transform_kinds": [],
      "language": null,
      "style": null,
      "spoken_commands": true,
      "context_fields": [],
      "processing_delivery": "staged",
      "delivery": "insert",
      "automatic_delivery": false
    },
    {
      "id": "message",
      "version": 1,
      "name": "Message",
      "description": "Like Draft, but Insert also presses the field's own action (Send, Search, Go) after inserting.",
      "intent": "dictate",
      "behavior": "faithful",
      "prompt_file": null,
      "aliases": [
        "message mode"
      ],
      "allow_spoken_overrides": true,
      "vocabulary": [],
      "snippets": [],
      "asr_route": "local-default",
      "authoring_route": null,
      "local_only": true,
      "selected_text": "off",
      "selection_required": false,
      "clipboard": false,
      "max_context_characters": 0,
      "transform_kinds": [],
      "language": null,
      "style": null,
      "spoken_commands": true,
      "context_fields": [],
      "processing_delivery": "staged",
      "delivery": "insert_enter",
      "automatic_delivery": false
    }
  ],
  "rules": []
}
